<?xml version="1.0" encoding="UTF-8"?>
<SAG:SBOMVulnerabilityAdvisory CVERespository="" NISTNVDSearchStatus="Success" PackageSourceLocation="" ProductName="" ProductVersion="" SBOMAuthor="" SBOMFormat="spdx" SBOMFormatSyntax="TV" SBOMLocation="" SBOMTimestamp="2001-12-31T12:00:00" SBOMTotalComponentCount="0" SupplierName="" UnresolvedVulnerabilities="Y" VulnDisclosureCreateDate="2001-12-31T12:00:00" xmlns:SAG="http://softwareassuranceguardian.com/2_1_1" xmlns:xsi="http://www.w3.org/2001/XMLSchema-instance" xsi:schemaLocation="http://softwareassuranceguardian.com/2_1_1 SBOMVARSchema.xsd ">
  <SAG:Component CVESearchString="" ComponentID="" ComponentName="" ComponentSupplierName="" ComponentVersion="" NumberVulnsReported="0">
    <SAG:CVE>
      <SAG:CVEID>SAG:CVEID</SAG:CVEID>
      <SAG:CVSS>SAG:CVSS</SAG:CVSS>
      <SAG:CVEDescription>SAG:CVEDescription</SAG:CVEDescription>
      <SAG:Exploitable>Y</SAG:Exploitable>
      <SAG:CISAKEV>Y</SAG:CISAKEV>
      <SAG:DisruptionImpact>None</SAG:DisruptionImpact>
      <SAG:FixStatus>N/A</SAG:FixStatus>
      <SAG:AnalysisFindings>SAG:AnalysisFindings</SAG:AnalysisFindings>
    </SAG:CVE>
  </SAG:Component>
</SAG:SBOMVulnerabilityAdvisory>
